{"checks":[{"actual":[],"expected":[],"id":"parser-warnings","passed":true},{"actual":[],"expected":[],"id":"parser-errors","passed":true},{"actual":"1.7","expected":"1.7","id":"pdf-version","passed":true},{"actual":1,"expected":1,"id":"page-count","passed":true},{"actual":[0,0,390,150.375],"expected":[0,0,390,150.375],"id":"media-box","passed":true},{"actual":[0,0,390,150.375],"expected":[0,0,390,150.375],"id":"crop-box","passed":true},{"actual":{},"expected":{},"id":"other-page-boxes","passed":true},{"actual":0,"expected":0,"id":"rotation","passed":true},{"actual":1,"expected":1,"id":"user-unit","passed":true},{"actual":3,"expected":3,"id":"font-count","passed":true},{"actual":4,"expected":4,"id":"form-count","passed":true},{"actual":6,"expected":6,"id":"mapping-count","passed":true},{"actual":2,"expected":2,"id":"annotation-count","passed":true},{"actual":7,"expected":7,"id":"clip-count","passed":true},{"actual":3,"expected":3,"id":"mask-count","passed":true},{"actual":2,"expected":2,"id":"image-count","passed":true},{"actual":[{"classification":"source","resource":"page/Im0"},{"classification":"source","resource":"page/Im0/SMask"}],"expected":[{"classification":"source","resource":"page/Im0"},{"classification":"source","resource":"page/Im0/SMask"}],"id":"image-inventory","passed":true},{"actual":602,"expected":602,"id":"operation-count","passed":true},{"actual":"678bb667b05d6ec652516f202d4e9b17e7960fb0f52b8f030b93de62e201fb6e","expected":"678bb667b05d6ec652516f202d4e9b17e7960fb0f52b8f030b93de62e201fb6e","id":"operation-sequence-sha256","passed":true},{"actual":"e33789145c274e9363302378e4d76b2bc3aed2643b1c456a758abf6389ad6b64","expected":"e33789145c274e9363302378e4d76b2bc3aed2643b1c456a758abf6389ad6b64","id":"structural-inventory-sha256","passed":true},{"actual":3,"expected":">=3","id":"operation-BDC","passed":true},{"actual":3,"expected":">=3","id":"operation-BT","passed":true},{"actual":8,"expected":">=8","id":"operation-CS","passed":true},{"actual":3,"expected":">=3","id":"operation-Do","passed":true},{"actual":3,"expected":">=3","id":"operation-EMC","passed":true},{"actual":3,"expected":">=3","id":"operation-ET","passed":true},{"actual":8,"expected":">=8","id":"operation-J","passed":true},{"actual":33,"expected":">=33","id":"operation-Q","passed":true},{"actual":8,"expected":">=8","id":"operation-S","passed":true},{"actual":8,"expected":">=8","id":"operation-SCN","passed":true},{"actual":3,"expected":">=3","id":"operation-Tf","passed":true},{"actual":38,"expected":">=38","id":"operation-Tj","passed":true},{"actual":38,"expected":">=38","id":"operation-Tm","passed":true},{"actual":7,"expected":">=7","id":"operation-W","passed":true},{"actual":180,"expected":">=180","id":"operation-c","passed":true},{"actual":25,"expected":">=25","id":"operation-cm","passed":true},{"actual":12,"expected":">=12","id":"operation-cs","passed":true},{"actual":4,"expected":">=4","id":"operation-d","passed":true},{"actual":8,"expected":">=8","id":"operation-f","passed":true},{"actual":1,"expected":">=1","id":"operation-f*","passed":true},{"actual":7,"expected":">=7","id":"operation-gs","passed":true},{"actual":9,"expected":">=9","id":"operation-h","passed":true},{"actual":2,"expected":">=2","id":"operation-j","passed":true},{"actual":30,"expected":">=30","id":"operation-l","passed":true},{"actual":92,"expected":">=92","id":"operation-m","passed":true},{"actual":7,"expected":">=7","id":"operation-n","passed":true},{"actual":33,"expected":">=33","id":"operation-q","passed":true},{"actual":4,"expected":">=4","id":"operation-re","passed":true},{"actual":12,"expected":">=12","id":"operation-scn","passed":true},{"actual":1,"expected":">=1","id":"operation-sh","passed":true},{"actual":8,"expected":">=8","id":"operation-w","passed":true},{"actual":false,"expected":false,"id":"encrypted","passed":true},{"actual":["/URI","/URI"],"expected":["/URI","/URI"],"id":"action-kinds","passed":true},{"actual":[],"expected":[],"id":"prohibited-actions","passed":true},{"actual":0,"expected":0,"id":"signature-count","passed":true},{"actual":0,"expected":0,"id":"incremental-revisions","passed":true},{"actual":false,"expected":false,"id":"linearized","passed":true},{"actual":null,"expected":null,"id":"info-dictionary","passed":true},{"actual":0,"expected":0,"id":"attachment-count","passed":true},{"actual":true,"expected":true,"id":"xmp-present","passed":true},{"actual":1,"expected":1,"id":"output-intent-count","passed":true},{"actual":"2.1","expected":"2.1","id":"output-profile-version","passed":true},{"actual":"mntr","expected":"mntr","id":"output-profile-class","passed":true},{"actual":"RGB","expected":"RGB","id":"output-profile-space","passed":true},{"actual":"XYZ","expected":"XYZ","id":"output-profile-pcs","passed":true},{"actual":"acsp","expected":"acsp","id":"output-profile-signature","passed":true},{"actual":true,"expected":true,"id":"output-profile-header","passed":true},{"actual":[],"expected":[],"id":"output-profile-tags","passed":true}],"document":{"actions":[{"classification":"uri","details":{"URI":"https://example.com/embed"},"kind":"/URI","location":"page[0]/annotation[0]/A","object":null},{"classification":"uri","details":{"URI":"https://example.com/shape"},"kind":"/URI","location":"page[0]/annotation[1]/A","object":null}],"attachments":{},"encrypted":false,"file_ids":["b:51d16aa38a42573925ba89faf7a53a90","b:51d16aa38a42573925ba89faf7a53a90"],"incremental_revisions":0,"info_dictionary":null,"linearized":false,"output_intents":[{"condition_identifier":"sRGB","info":"excalidraw-render project sRGB","object":"6 0 R","profile":{"byte_length":820,"color_space":"RGB","device_class":"mntr","pcs":"XYZ","sha256":"20b2514b38138f0bd775cb08dbe06a7a68b736b3dba0881a2d6fa91636fd87be","signature":"acsp","tags":["rXYZ","gXYZ","bXYZ","wtpt","rTRC","gTRC","bTRC"],"valid_header":true,"version":"2.1"},"profile_object":"5 0 R","subtype":"/GTS_PDFA1"}],"page_count":1,"pdf_version":"1.7","signatures":[],"xmp":{"byte_length":5202,"sha256":"a1fb180cdda81e34c1870511cb788d2409a43499a063af4a86d87fbf97165176"}},"errors":[],"expected_pass":true,"pages":[{"annotations":[{"action":{"kind":"/URI","uri":"https://example.com/embed"},"additional_actions":null,"border":[0,0,0],"flags":0,"object":"11 0 R","quad_points":[277.5,60,382.5,60,277.5,7.5,382.5,7.5],"rect":[277.5,7.5,382.5,60],"subtype":"/Link"},{"action":{"kind":"/URI","uri":"https://example.com/shape"},"additional_actions":null,"border":[0,0,0],"flags":0,"object":"12 0 R","quad_points":[22.5,112.5,142.5,112.5,22.5,67.5,142.5,67.5],"rect":[22.5,67.5,142.5,112.5],"subtype":"/Link"}],"clips":[{"operands":[],"operator":"W","scope":"page","sequence":54},{"operands":[],"operator":"W","scope":"page","sequence":375},{"operands":[],"operator":"W","scope":"page","sequence":383},{"operands":[],"operator":"W","scope":"page/Svg0/gs1/SMask","sequence":398},{"operands":[],"operator":"W","scope":"page/Svg0/xo0","sequence":425},{"operands":[],"operator":"W","scope":"page/Svg0/xo0","sequence":435},{"operands":[],"operator":"W","scope":"page/Svg0/xo0","sequence":490}],"crop_box":[0,0,390,150.375],"fonts":[{"base_font":"/AAGKCL+LiberationSans","descendant_subtype":"/CIDFontType2","embedded":true,"embedded_sha256":"34ccb2d4a3e2411f2f1f3db224aa800f9dd1277db1d2a606eca07575f134a123","encoding":"/Identity-H","object":"13 0 R","resource":"page/F1","subtype":"/Type0","to_unicode":true,"to_unicode_byte_length":393,"to_unicode_sha256":"56a9f6a2332d8e0e00e0de4bcdd48aadf76b30f214a4dc9a4f6e885341ba605a"},{"base_font":"/OEECDL+Excalifont","descendant_subtype":"/CIDFontType2","embedded":true,"embedded_sha256":"a648fcf03710b94a05748575a4bc5ddb056b19806869326f140a7d4ccf3f8bbb","encoding":"/Identity-H","object":"19 0 R","resource":"page/F2","subtype":"/Type0","to_unicode":true,"to_unicode_byte_length":417,"to_unicode_sha256":"7e172823ee0c70e6001d3e08e66a209a8d7f2cd6678d470267a98c32fc9a0243"},{"base_font":"/AAGKCL+LiberationSans","descendant_subtype":"/CIDFontType2","embedded":true,"embedded_sha256":"34ccb2d4a3e2411f2f1f3db224aa800f9dd1277db1d2a606eca07575f134a123","encoding":"/Identity-H","object":"25 0 R","resource":"page/F3","subtype":"/Type0","to_unicode":true,"to_unicode_byte_length":548,"to_unicode_sha256":"1e2686284450d994b8911e72d5e5739987fac175122ba9e2c770e4a0df4684c6"}],"forms":[{"bbox":[0,0,80,40],"group":null,"matrix":[0.0125,0,0,0.025,0,0],"object":"50 0 R","occurrences":1,"resource":"page/Svg0"},{"bbox":[4,0,82,40],"group":{"color_space":["/ICCBased","36 0 R"],"isolated":true,"knockout":false,"subtype":"/Transparency"},"matrix":[1,0,0,1,0,0],"object":"49 0 R","occurrences":1,"resource":"page/Svg0/xo0"},{"bbox":[-5.8,-4,87.8,44],"group":{"color_space":["/ICCBased","36 0 R"],"isolated":false,"knockout":false,"subtype":"/Transparency"},"matrix":[1,0,0,1,0,0],"object":"38 0 R","occurrences":1,"resource":"page/Svg0/gs1/SMask"},{"bbox":[1,5.5,21.473116,18.473116],"group":{"color_space":["/ICCBased","42 0 R"],"isolated":false,"knockout":false,"subtype":"/Transparency"},"matrix":[1,0,0,1,0,0],"object":"43 0 R","occurrences":1,"resource":"page/Svg0/xo0/gs0/SMask"}],"images":[{"bits_per_component":8,"byte_length":3,"classification":"source","color_space":"/CS1","data_sha256":"709e80c88487a2411e1ee4dfb9f22a861492d20c4765150c0c794abd70f8147c","filters":null,"height":1,"interpolate":false,"mask":null,"object":"31 0 R","occurrences":1,"resource":"page/Im0","soft_mask":"32 0 R","width":1},{"bits_per_component":8,"byte_length":1,"classification":"source","color_space":"/DeviceGray","data_sha256":"a8100ae6aa1940d0b663bb31cd466142ebbdbd5187131b92d93818987832eb89","filters":null,"height":1,"interpolate":false,"mask":null,"object":"32 0 R","occurrences":1,"resource":"page/Im0/SMask","soft_mask":null,"width":1}],"mappings":[{"byte_length":393,"kind":"to-unicode","operands":[],"resource":"page/F1","scope":"page","sequence":null,"sha256":"56a9f6a2332d8e0e00e0de4bcdd48aadf76b30f214a4dc9a4f6e885341ba605a"},{"byte_length":417,"kind":"to-unicode","operands":[],"re